{
  "id": "TCKT-10293",
  "subject": "Unable to reset my password",
  "description": "I clicked the password reset link in my email but never received the confirmation code. I've tried three times in the last hour.",
  "status": "open",
  "priority": "normal",
  "channel": "email",
  "requester": {
    "id": "C-4521",
    "name": "Jane Doe",
    "email": "jane@example.com"
  },
  "assignee_id": "AGT-17",
  "group_id": "GRP-billing",
  "tags": ["password-reset", "account", "tier-2"],
  "sla_breached": false,
  "created_at": "2026-05-19T14:23:00Z",
  "updated_at": "2026-05-19T15:02:00Z"
}
